,Dir_Name_Display,Dir_School_Code,Dir_Street,Dir_Zip,AYP_Status,AYP_Status_Desc,Energy_Star_Rtg,Enroll_Total,Prog_Growth_Math_Current_Year,Prog_Growth_Read_Current_Year,Perf_Growth,Safe_ISA_Current_Year,Safe_Truancy_Current_Year,Safe_Suspension_Current_Year,Safe_Incidents_Current_Year,Safe_Safety_Current_Year,Perf_Safety,Perf_Engage_Current_Year,Perf_Teachers_Current_Year,Performance of Growth,Performance of Safety,Performance of Engage,Performance of Teachers,Performance,Ranking
3,Oyster-Adams Bilingual School,292,2801 Calvert St. NW and 2020 19th St. NW,20008,Reward,Reward schools have the highest levels of student performance and growth as demonstrated by an overall index score at or above 80 or growth in overall index score that falls in the top 5% of all schools in DC.,58.0,674.0,0.6,0.68,0.64,0.96,0.02,0.0,0.0,0.95,1.89,0.91,0.94,5,5,4,4,4.5,5
10,School Without Walls @ Francis-Stevens,409,2425 N St. NW,20037,Rising,Rising schools need support to continue growth. They have an overall index score above 44 but less than 80 and are not identified as Priority or Focus schools by any other criteria.,52.0,471.0,0.68,0.59,0.64,0.93,0.13,0.03,0.0,0.91,1.68,0.88,0.94,5,4,4,4,4.25,5
20,Whittier Education Campus,338,6201 5th St. NW,20011,Focus,Focus schools need targeted support to address large subgroup achievement gaps relative to all schools in DC. Focus schools must develop an intervention plan to address specified subgroups and report twice a year on planned milestones.,71.0,341.0,0.67,0.65,0.66,0.93,0.17,0.01,0.0,0.97,1.72,0.98,0.93,5,4,5,3,4.25,5
21,Capitol Hill Montessori School @ Logan,360,215 G Street NE,20002,Focus,Focus schools need targeted support to address large subgroup achievement gaps relative to all schools in DC. Focus schools must develop an intervention plan to address specified subgroups and report twice a year on planned milestones.,90.0,361.0,0.79,0.77,0.78,0.95,0.08,0.01,0.0,0.96,1.82,0.94,0.89,5,5,5,2,4.25,5
18,West Education Campus,336,1335 Farragut St. NW,20011,Rising,Rising schools need support to continue growth. They have an overall index score above 44 but less than 80 and are not identified as Priority or Focus schools by any other criteria.,4.0,315.0,0.65,0.52,0.59,0.94,0.1,0.02,0.0,0.9,1.72,0.93,0.93,4,4,5,3,4.0,5
